{
  "schema_version": "prodocux_render_result_v1",
  "status": "failed",
  "kernel_version": "0.3.0rc1",
  "renderer_id": "none",
  "renderer_version": "none",
  "target_format": "docx",
  "request_id": "g1a-render-docx-artifact",
  "validation": {
    "passed": false,
    "reasons": ["RENDERER_NOT_AVAILABLE"]
  },
  "error": {
    "code": "RENDERER_NOT_AVAILABLE",
    "message": "no renderer is available for this format yet"
  }
}
